{
  "meta": {
    "api-version": "1.0"
  },
  "name": "Sample_Project",
  "versions": [
    "1.0.0",
    "1.1.0"
  ],
  "files": [
    {
      "filename": "sample_project-1.0.0-py3-none-any.whl",
      "url": "https://files.pythonhosted.org/packages/sample_project-1.0.0-py3-none-any.whl",
      "hashes": {
        "sha256": "1111111111111111111111111111111111111111111111111111111111111111"
      },
      "requires-python": ">=3.9",
      "yanked": false,
      "size": 12345,
      "upload-time": "2024-01-02T03:04:05Z",
      "dist-info-metadata": {
        "sha256": "2222222222222222222222222222222222222222222222222222222222222222"
      },
      "gpg-sig": false
    },
    {
      "filename": "sample_project-1.1.0.tar.gz",
      "url": "https://files.pythonhosted.org/packages/sample_project-1.1.0.tar.gz",
      "hashes": {
        "sha256": "3333333333333333333333333333333333333333333333333333333333333333"
      },
      "requires-python": ">=3.10",
      "yanked": "bad metadata",
      "size": 23456,
      "upload-time": "2024-02-03T04:05:06Z"
    }
  ]
}
